{
  "schema": "mcp-secure-context.container.v0.1",
  "containerType": "task_state",
  "id": "task-handoff-1",
  "version": "0.1.0",
  "payload": {
    "taskId": "task-handoff-1",
    "goal": "Hand off the active workflow state to another agent",
    "status": "blocked",
    "currentStep": "Await external review",
    "blockingReasons": ["Missing external approval"],
    "recommendedAction": "Request approval from the receiving operator",
    "attentionState": "needs_attention",
    "artifactRefs": ["artifact://draft-1"],
    "decisionRefs": ["decision://review-1"],
    "nextStepRefs": ["next://handoff-1"],
    "activeRunId": "run-42",
    "summary": "The work item is paused until approval is granted.",
    "updatedAt": "2026-04-17T00:00:00.000Z",
    "updatedBy": "agent://planner"
  },
  "policy": {
    "audience": ["agent"],
    "allowedActions": ["read"],
    "sensitivity": "internal",
    "leastPrivilegeScope": "workflow.handoff"
  },
  "provenance": {
    "createdAt": "2026-04-17T00:00:00.000Z",
    "createdBy": "agent://planner",
    "sourceRefs": ["project://alpha/work-item-7"],
    "derivation": "Bounded workflow-control-plane handoff state"
  }
}
